<?xml version="1.0" encoding="UTF-8"?>

<plateau xmlns:xsi="http://www.w3.org/2001/XMLSchema-instance" xsi:noNamespaceSchemaLocation="initialisation.xsd">
    <nom>Simulateur ACO</nom>
    <width>30</width>
    <heigth>30</heigth>
    <liste_agentite>
        <nid>
            <nom>Fourmil√®re</nom>
            <position>
                <x>20</x>
                <y>20</y>
            </position>
        </nid>
        <fourmis>2</fourmis>
        <nourritures>
            <nourriture>
                <quantite>50</quantite>
                <position>
                    <x>10</x>
                    <y>10</y>
                </position>
            </nourriture>
            <nourriture>
                <quantite>60</quantite>
                <position>
                    <x>15</x>
                    <y>15</y>
                </position>
            </nourriture>
        </nourritures>
        <obstacles>
            <obstacle>
                <position>
                    <x>5</x>
                    <y>5</y>
                </position>
            </obstacle>
            <obstacle>
                <position>
                    <x>5</x>
                    <y>6</y>
                </position>
            </obstacle>
        </obstacles>
    </liste_agentite>

</plateau>